|date|contents
46|2014-10-16T12:07:17.000Z|"""Top 1% 'own half global wealth' - Credit Suisse report - BBC NewsBBC HomepageSkip to contentAccessibility HelpYour accountNotificationsHomeNewsSportWeatheriPlayerSoundsBitesizeMore menuMore menuSearch BBCHomeNewsSportWeatheriPlayerSoundsBitesizeCBBCCBeebiesFoodClose menuBBC NewsMenuHomeCost of LivingWar in UkraineClimateUKWorldBusinessPoliticsCultureTechMoreScienceHealthFamily & EducationIn PicturesNewsbeatReality CheckDisabilityBusinessYour MoneyMarket DataCompaniesEconomyTechnology of BusinessCEO SecretsGlobal TradeTop 1% 'own half global wealth' - Credit Suisse reportThis video can not be playedTo play this video you need to enable JavaScript in your browser.Top 1% 'own half global wealth' - Credit Suisse reportCloseThe richest 1% of people own nearly half the world's wealth, according to a report out this week.With total global wealth more than doubling this century, total household wealth in China is now the third highest in the world, only surpassed by the US and Japan, says the report by banking giant Credit Suisse.BBC News investigates its findings - in 60 seconds. Video produced by Michael HirstPublished16 October 2014SectionNewsSubsectionBusinessShareclose panelShare pageCopy linkAbout sharingRead descriptionExplore moreWealth report - in 60 seconds. Video, 00:01:01Wealth report - in 60 secondsPublished16 October 2014SubsectionBusiness1:01Up Next. Why are there so many North Korea rumours? Video, 00:01:00Why are there so many North Korea rumours?Published15 October 2014SubsectionAsiaUp Next1:00Could Ebola outbreak infect 1.4m? Video, 00:01:03Could Ebola outbreak infect 1.4m?Published13 October 2014SubsectionHealth1:03How does the International Criminal Court work? Video, 00:01:03How does the International Criminal Court work?Published8 October 2014SubsectionWorld1:03Hajj in numbers - in 60 seconds. Video, 00:01:04Hajj in numbers - in 60 secondsPublished24 September 2015SubsectionMiddle East1:04Editor's recommendationsA look at the King's golden coronation day coaches. Video, 00:01:22A look at the King's golden coronation day coachesPublished6 hours agoSubsectionUK1:22Giant sketch in field marks Picasso death anniversary. Video, 00:00:26Giant sketch in field marks Picasso death anniversaryPublished1 day agoSubsectionEurope0:26Video shows avalanche in French Alps. Video, 00:00:29Video shows avalanche in French AlpsPublished22 hours agoSubsectionEurope0:29Songs of grief for sisters killed in occupied West Bank. Video, 00:00:56Songs of grief for sisters killed in occupied West BankPublished1 day agoSubsectionMiddle East0:56China conducts Taiwan military drills. Video, 00:00:45China conducts Taiwan military drillsPublished2 days agoSubsectionChina0:45Labour's Lucy Powell challenged over Sunak attack ad. Video, 00:01:11Labour's Lucy Powell challenged over Sunak attack adPublished3 days agoSubsectionUK Politics1:11Forget a K9 unit, this police station has a bunny. Video, 00:01:07Forget a K9 unit, this police station has a bunnyPublished3 days agoSubsectionUS & Canada1:07The damage done by 80 tornadoes in a week. Video, 00:01:36The damage done by 80 tornadoes in a weekPublished3 days agoSubsectionUS & Canada1:36Watch: One of Macron's favourite cafes in flames. Video, 00:00:22Watch: One of Macron's favourite cafes in flamesPublished4 days agoSubsectionEurope0:22Lightning strikes the tip of Toronto's CN Tower. Video, 00:00:21Lightning strikes the tip of Toronto's CN TowerPublished4 days agoSubsectionUS & Canada0:21Best of the BBCExploring the legacy of the peace dealAttributionBBC iPlayerDo sleepy teas really work?AttributionBBC SoundsWill Grace be able to keep her word?AttributionBBC iPlayerA spinster turned mass poisoner...AttributionBBC SoundsHomeNewsSportWeatheriPlayerSoundsCBBCCBeebiesFoodBitesizeArtsTasterLocalThreeTerms of UseAbout the BBCPrivacy PolicyCookiesAccessibility HelpParental GuidanceContact the BBCMake an editorial complaintGet Personalised NewslettersWhy you can trust the BBC© 2023 BBC. The BBC is not responsible for the content of external sites. Read about our approach to external linking."""
47|2011-07-27T09:52:50.000Z|"""Credit Suisse 'played important role' in Isle of Man - BBC NewsBBC HomepageSkip to contentAccessibility HelpYour accountNotificationsHomeNewsSportWeatheriPlayerSoundsBitesizeMore menuMore menuSearch BBCHomeNewsSportWeatheriPlayerSoundsBitesizeCBBCCBeebiesFoodClose menuBBC NewsMenuHomeCost of LivingWar in UkraineClimateUKWorldBusinessPoliticsCultureTechMoreScienceHealthFamily & EducationIn PicturesNewsbeatReality CheckDisabilityUKEnglandN. IrelandScotlandAlbaWalesCymruIsle of ManGuernseyJerseyLocal NewsCredit Suisse 'played important role' in Isle of ManPublished27 July 2011Shareclose panelShare pageCopy linkAbout sharingCredit Suisse has ""played an important role"" in the Isle of Man's economic development, says the government.The department of economic development said it was aware of the proposed scaling down of the bank's fund administration business on the island.Credit Suisse has confirmed jobs could go from its Isle of Man office as it ""realigns resources to growth areas"".A government spokesman said the Swiss bank had played an important role in developing the island's funds sector.He added: ""The support and commitment which the team have provided has been much appreciated"". Economic development minister Allan Bell said he was hopeful the island would be able to retain some sort of link with Credit Suisse.He added: ""We have to be very careful because the Isle of Man has struggled to maintain critical mass in the fund sector industry.More aggressive""We have a number of competing jurisdictions which have been more aggressive and more successful in the past, primarily because they have been in the business longer than the Isle of Man"".Credit Suisse has not confirmed how many jobs will be cut in the changes but said: ""We continue to be proactive about monitoring the size of our business relative to client opportunities and market conditions.""This involves realigning resources to growth areas and adjusting capacity to meet client needs and to manage costs across the business"".Two years ago, nine Isle of Man jobs were lost when the company moved some of its operations to Guernsey.More on this storyManx job threat at Credit Suisse21 July 2011Related Internet LinksIOM Economic DevelopmentCredit SuisseThe BBC is not responsible for the content of external sites.From other local news sitesGrease meets the Blues BrothersExternalIsle of Man NewspapersSteam Packet services in doubt because of forecast bad weatherExternalIsle of Man NewspapersSteam Packet warn of disruption to tomorrow's sailingsExternalManx RadioLocal charity wins Play and Community Development awardExternal3FM Isle of ManEmergency service release details of road traffic collisionExternalManx RadioNew EV charging units at Noble'sExternal3FM Isle of ManInformation about BBC links to other news sitesTop StoriesUK-Israeli mother wounded in West Bank attack diesPublished50 minutes agoLive. Five dead in shooting at Kentucky bankPublished2 hours agoNHS braces for most disruptive walkout yetPublished23 minutes agoFeaturesWhat does the huge leak of Ukraine war documents tell us?We were born on the day the peace deal was signed. VideoWe were born on the day the peace deal was signedMan, 100, learns to walk to attend school assembly. VideoMan, 100, learns to walk to attend school assemblyAngler enjoys rare Channel encounter with whaleTwo years for murder still Good Friday's bitter pillThe EU politician fighting his own extraditionThe refugees making a living after fleeing UkraineWhat lies behind the rise of the contraception app?An asylum seeker's five-nation trek to sanctuaryElsewhere on the BBC'Is this my fault?!'Emily Atack seeks to understand why the blame for unwanted male attention is so often put on the victimAttributioniPlayerFrom party tricks to questionable medicinal claimsExploring the downright bizarre ways that the force of electricity has been harnessed and developedAttributionSoundsCan this determined sleuth solve a mysterious murder case?Anthony Horowitz's mind-bending mystery, starring Lesley ManvilleAttributioniPlayerDo 29,000 coffee pods go to landfill every minute?More or Less explores the environmental consequences of our thirst for coffeeAttributionSoundsMost Read1Rain and 60mph winds to replace Easter sunshine2Dalai Lama regrets asking boy to 'suck my tongue'3UK-Israeli mother wounded in West Bank attack dies4Elf and Barton Fink actor Michael Lerner dies at 815US woman, 78, charged with third bank robbery6Petrol bombs thrown at police at republican parade7Abba in tribute to 'superb' long-serving guitarist8China aircraft carrier 'seals off' Taiwan in drill9Super Mario Movie breaks box office records10Officer among eight injured in Louisville shootingBBC News ServicesOn your mobileOn smart speakersGet news alertsContact BBC NewsBest of the BBCExploring the legacy of the peace dealAttributionBBC iPlayerDo sleepy teas really work?AttributionBBC SoundsWill Grace be able to keep her word?AttributionBBC iPlayerA spinster turned mass poisoner...AttributionBBC SoundsHomeNewsSportWeatheriPlayerSoundsCBBCCBeebiesFoodBitesizeArtsTasterLocalThreeTerms of UseAbout the BBCPrivacy PolicyCookiesAccessibility HelpParental GuidanceContact the BBCMake an editorial complaintGet Personalised NewslettersWhy you can trust the BBC© 2023 BBC. The BBC is not responsible for the content of external sites. Read about our approach to external linking."""
48|2017-12-08T11:29:33.000Z|"""Learn how the BBC is working to strengthen trust and transparency in online news - BBC NewsBBC HomepageSkip to contentAccessibility HelpYour accountNotificationsHomeNewsSportWeatheriPlayerSoundsBitesizeMore menuMore menuSearch BBCHomeNewsSportWeatheriPlayerSoundsBitesizeCBBCCBeebiesFoodClose menuBBC NewsMenuHomeCost of LivingWar in UkraineClimateUKWorldBusinessPoliticsCultureTechMoreScienceHealthFamily & EducationIn PicturesNewsbeatReality CheckDisabilityLearn how the BBC is working to strengthen trust and transparency in online newsPublished8 December 2017Shareclose panelShare pageCopy linkAbout sharingThe BBC is recognised by audiences in the UK and around the world as a provider of news that you can trust. Our website, like our TV and radio services, strives for journalism that is accurate, impartial, independent and fair.Our editorial values say: ""The trust that our audience has in all our content underpins everything that we do. We are independent, impartial and honest. We are committed to achieving the highest standards of accuracy and impartiality and strive to avoid knowingly or materially misleading our audiences.""Our commitment to impartiality is at the heart of that relationship of trust. In all our output we will treat every subject with an impartiality that reflects the full range of views. We will consider all the relevant facts fairly and with an open mind.""Research shows that, compared to other broadcasters, newspapers and online sites, the BBC is seen as by far the most trusted and impartial news provider in the UK [PDF].Even so, we know that identifying credible journalism on the internet can be a confusing experience. We also know that audiences want to understand more about how BBC journalism is produced.For these reasons, BBC News is making even greater efforts to explain what type of information you are reading or watching on our website, who and where the information is coming from, and how a story was crafted the way it was. By doing so, we can help you judge for yourself why BBC News can be trusted.We are also making these indicators of trustworthy journalism ""machine-readable"", meaning that they can be picked up by search engines and social media platforms, helping them to better identify reliable sources of information too. These indicators comprise the following areas:Newsroom best practiceType of WorkJournalist ExpertiseCitations and ReferencesMethodology

BEST PRACTICEThe BBC has long had its own Editorial Guidelines that apply to all of our content and set out the standards expected of our journalists.  To make it easier to see how BBC guidelines are used in our newsroom, we have listed all the relevant sections on this page.

Mission Statement: The mission of the BBC is to act in the public interest, serving all audiences through the provision of impartial, high-quality and distinctive output and services that inform, educate and entertain. Full details are in the BBC Charter.

Ownership Structure, Funding and Grants: We are independent of outside interests and arrangements that could undermine our editorial integrity.  Our audiences should be confident that our decisions are not influenced by outside interests, political or commercial pressures, or any personal interests. Learn more about how BBC News is funded, in the UK and internationally, in the BBC Charter on the independence of the BBC.Other links:Editorial Guidelines on ImpartialityEditorial Guidelines on Editorial StandardsEditorial Guidelines on Conflicts of InterestBBC Framework Agreement on provision of commercial activitiesGuidelines for BBC Commercial ServicesFounding Date: The BBC was founded on 18 October 1922. Read more about the history of the BBC.Ethics Policy: The BBC's Editorial Guidelines outline the editorial values and practices that all our output is expected to conform to.  Other links:BBC Charter and Framework AgreementBBC World Service Operating Licence

Diversity Policy: Learn about BBC News' commitment to diversity in the BBC Charter.Other links:Editorial Guidelines Section on Impartiality and Diversity of OpinionDiversity and Inclusion pageDiversity Staffing Report: Find out about how BBC News is working to increase diversity in the BBC's Equality Information Report.Corrections: The BBC is committed to achieving due accuracy.  Policies relating to corrections can be found in the following sections of our Editorial Guidelines. Our output must be well sourced, based on sound evidence, thoroughly tested and presented in clear, precise language.  We should be honest and open about what we don't know and avoid unfounded speculation.  Claims, allegations, material facts and other content that cannot be corroborated should normally be attributed.We are open in acknowledging mistakes when they are made and encourage a culture of willingness to learn from them. If an article has been edited since publication to correct a material inaccuracy, a note will be added at the end of the text to signal to the reader there has been an amendment or correction with the date of that change. If there is a small error in a story that does not alter its editorial meaning (eg name misspelling), the correction will be made without an additional note.Unless content is specifically made available only for a limited time period, there is a presumption that material published online will become part of a permanently accessible archive and will not normally be removed. Exceptional circumstances may include legal reasons, personal safety risks, or a serious breach of editorial standards that cannot be rectified except by removal of the material.Other links:Editorial Guidelines on AccountabilityEditorial Guidelines on Removal of Online ContentVerification/Fact-checking Standards: The BBC's accuracy and verification policy is outlined in the Editorial Guidelines on Accuracy.Other links:Ofcom Operating Framework and Licence for the BBCUnnamed Sources:  The BBC's policy and guidance on the use of anonymous sources is detailed in the Editorial Guidelines.Other links:Editorial Guidelines - Mandatory referralsEditorial Guidelines - Gathering materialEditorial Guidelines on user contributions in news outputActionable Feedback: The BBC's complaints procedure is outlined in the BBC Complaints Framework.Other links:Have Your SayContact UsLeadership: Meet the senior executive team that runs the news division: BBC News Board. 

BBC News articles based on original reporting carry bylines (the name of the journalist), as often do those authored by journalists who have a subject specialism.General news stories, which tend to combine information from a variety of sources, including news agencies, BBC Newsgathering and BBC broadcast output, or which may have been produced by several members of staff over the course of the day, do not as a rule carry bylines.Article bylines for many correspondents and editors link to individual blog pages, where biographical information, expertise, and social media details can be found. 

BBC News distinguishes between factual reporting and opinion. We use machine-readable labels in six categories:News - Journalism based on facts, either observed and verified directly by the reporter, or reported and verified from knowledgeable sourcesAnalysis - Output primarily based on the specialist knowledge of an author, whether a BBC journalist or outside expert, to help you understand complex current affairs and trendsAsk the Audience - Content created primarily to elicit direct audience responseExplainer - Content that provides clear factual explanation of the causes or context behind the newsOpinion - BBC News itself is impartial and does not offer opinions but we do sometimes publish expressions of personal views by outside experts, advocating ideas and drawing conclusions based on the author's interpretation of facts and dataReview - Content based on a critical appraisal of an event, a work of art etc, containing first-hand opinion 

Our output, as appropriate to its subject and nature, should be well sourced, based on sound evidence, thoroughly tested and presented in clear, precise language.  We strive to be honest and open about what we don't know and avoid unfounded speculation. Where BBC News relies on a single source for a key aspect of its coverage, we will strive to credit that source, where possible. We usually link to official reports, sets of statistics and other sources of information, to enable you to judge for yourself the underlying information that we are reporting on.Whenever appropriate, we also offer links to relevant third-party websites that provide additional information, source material or informed comment.

For in-depth pieces of work, such as complex investigations or data journalism projects, we will help you understand how we went about our work by showing the underlying data and by disclosing any caveats, assumptions or other methodological frameworks used - for example, the study-design; the sample size; representativeness; margins of error; how the data was collected; geographical relevance and time periods.
BBC News ServicesOn your mobileOn smart speakersGet news alertsContact BBC NewsBest of the BBCExploring the legacy of the peace dealAttributionBBC iPlayerDo sleepy teas really work?AttributionBBC SoundsWill Grace be able to keep her word?AttributionBBC iPlayerA spinster turned mass poisoner...AttributionBBC SoundsHomeNewsSportWeatheriPlayerSoundsCBBCCBeebiesFoodBitesizeArtsTasterLocalThreeTerms of UseAbout the BBCPrivacy PolicyCookiesAccessibility HelpParental GuidanceContact the BBCMake an editorial complaintGet Personalised NewslettersWhy you can trust the BBC© 2023 BBC. The BBC is not responsible for the content of external sites. Read about our approach to external linking."""
49|2014-03-21T20:56:10.000Z|"""Credit Suisse pays $885m to settle US mortgage case - BBC NewsBBC HomepageSkip to contentAccessibility HelpYour accountNotificationsHomeNewsSportWeatheriPlayerSoundsBitesizeMore menuMore menuSearch BBCHomeNewsSportWeatheriPlayerSoundsBitesizeCBBCCBeebiesFoodClose menuBBC NewsMenuHomeCost of LivingWar in UkraineClimateUKWorldBusinessPoliticsCultureTechMoreScienceHealthFamily & EducationIn PicturesNewsbeatReality CheckDisabilityBusinessYour MoneyMarket DataCompaniesEconomyTechnology of BusinessCEO SecretsGlobal TradeCredit Suisse pays $885m to settle US mortgage casePublished21 March 2014Shareclose panelShare pageCopy linkAbout sharingImage source, AFPCredit Suisse has agreed to pay $885m (£536m) to settle claims it mis-sold mortgage-backed securities in the US before the financial crisis.The Swiss bank was accused of misleading US government-backed mortgage giants, Fannie Mae and Freddie Mac, over the quality of the products.The two mortgage firms, which received government bailouts in 2008, will be paid $234m and $651m respectively.More than $10.1bn has been recovered from banks in similar actions.The Credit Suisse settlement is the ninth that the Federal Housing Finance Agency (FHFA) has reached over some $200bn in mortgage-backed securities - an investment product at the centre of the global financial crisis.Since 2011 the FHFA, which oversees Fannie Mae and Freddie Mac, has filed 18 lawsuits against banks over the products.Credit Suisse said the settlement resolved its biggest remaining mortgage-related lawsuit.It covered $16.6bn of securities sold to the two mortgage companies between 2005 and 2007.The bank said it would reduce previously reported 2013 annual earnings by 275m Swiss francs ($311m; £188m) as a result of the settlement.More on this storySwiss bank boss 'regrets' tax ploy26 February 2014Credit Suisse 'aided' US tax evaders26 February 2014Morgan Stanley pays out $1.25bn5 February 2014JP Morgan in record $13bn settlement20 November 2013Related Internet LinksFHFACredit SuisseThe BBC is not responsible for the content of external sites.Top StoriesUK-Israeli mother wounded in West Bank attack diesPublished50 minutes agoLive. Five dead in shooting at Kentucky bankPublished2 hours agoNHS braces for most disruptive walkout yetPublished23 minutes agoFeaturesWhat does the huge leak of Ukraine war documents tell us?We were born on the day the peace deal was signed. VideoWe were born on the day the peace deal was signedMan, 100, learns to walk to attend school assembly. VideoMan, 100, learns to walk to attend school assemblyAngler enjoys rare Channel encounter with whaleTwo years for murder still Good Friday's bitter pillThe EU politician fighting his own extraditionThe refugees making a living after fleeing UkraineWhat lies behind the rise of the contraception app?An asylum seeker's five-nation trek to sanctuaryElsewhere on the BBC'Is this my fault?!'Emily Atack seeks to understand why the blame for unwanted male attention is so often put on the victimAttributioniPlayerFrom party tricks to questionable medicinal claimsExploring the downright bizarre ways that the force of electricity has been harnessed and developedAttributionSoundsCan this determined sleuth solve a mysterious murder case?Anthony Horowitz's mind-bending mystery, starring Lesley ManvilleAttributioniPlayerDo 29,000 coffee pods go to landfill every minute?More or Less explores the environmental consequences of our thirst for coffeeAttributionSoundsMost Read1Rain and 60mph winds to replace Easter sunshine2Dalai Lama regrets asking boy to 'suck my tongue'3UK-Israeli mother wounded in West Bank attack dies4Elf and Barton Fink actor Michael Lerner dies at 815US woman, 78, charged with third bank robbery6Petrol bombs thrown at police at republican parade7Abba in tribute to 'superb' long-serving guitarist8China aircraft carrier 'seals off' Taiwan in drill9Super Mario Movie breaks box office records10Officer among eight injured in Louisville shootingBBC News ServicesOn your mobileOn smart speakersGet news alertsContact BBC NewsBest of the BBCExploring the legacy of the peace dealAttributionBBC iPlayerDo sleepy teas really work?AttributionBBC SoundsWill Grace be able to keep her word?AttributionBBC iPlayerA spinster turned mass poisoner...AttributionBBC SoundsHomeNewsSportWeatheriPlayerSoundsCBBCCBeebiesFoodBitesizeArtsTasterLocalThreeTerms of UseAbout the BBCPrivacy PolicyCookiesAccessibility HelpParental GuidanceContact the BBCMake an editorial complaintGet Personalised NewslettersWhy you can trust the BBC© 2023 BBC. The BBC is not responsible for the content of external sites. Read about our approach to external linking."""
