|date|contents
10|2022-10-27T10:29:52.000Z|"""Credit Suisse cuts 9,000 jobs to stem losses - BBC NewsBBC HomepageSkip to contentAccessibility HelpYour accountNotificationsHomeNewsSportWeatheriPlayerSoundsBitesizeMore menuMore menuSearch BBCHomeNewsSportWeatheriPlayerSoundsBitesizeCBBCCBeebiesFoodClose menuBBC NewsMenuHomeCost of LivingWar in UkraineClimateUKWorldBusinessPoliticsCultureTechMoreScienceHealthFamily & EducationIn PicturesNewsbeatReality CheckDisabilityBusinessYour MoneyMarket DataCompaniesEconomyTechnology of BusinessCEO SecretsGlobal TradeCredit Suisse cuts 9,000 jobs to stem lossesPublished27 October 2022Shareclose panelShare pageCopy linkAbout sharingImage source, ReutersBanking giant Credit Suisse is cutting thousands of jobs and restructuring its business in an attempt to stem heavy losses and investor concerns. After scandals in recent years and a SF4bn ($4bn, £3.5bn) loss in the most recent quarter, the bank said it was taking ""a series of decisive actions"".It said 9,000 posts would go over the next three years but did not say where the cuts would fall.Chairman Axel Lehmann dubbed the overhaul a ""blueprint for success"".But investors did not respond positively, with Credit Suisse shares down more than 13% following the announcement.As part of the restructuring plan Credit Suisse aims to raise $4bn in new capital, $1.5bn of which will come from Saudi National Bank.It plans to spin off the bank's investment arm, relaunching the CS First Boston brand, and wind down some of its higher-risk businesses. Credit Suisse shares hit by financial health fearsHSBC climate change adverts banned by UK watchdogCap on bankers' bonuses will still be liftedThe workforce will fall from 52,000 now to 43,000 by the end of 2025, with 2,700 jobs going before the end of this year. Credit Suisse is based in Switzerland, but has a major hub in London and employs 5,500 people in the UK.That will help it shrink its overall cost base by SFr2.5bn or 15% by 2025, it said. It is also setting up a ""bad bank"" unit to house high-risk assets that it wants to wind down.This is the third attempt in recent years to turn around the embattled group after a series of scandals hit the bank, once considered a stalwart of Swiss respectability.In February 2020, its then chief executive Tidjane Thiam left after a scandal around covert surveillance operations. In March that year the Archegos investment fund imploded saddling Credit Suisse with huge losses and it was also dealt a blow by the collapse of the British finance company Greensill Capital.Last year, the bank's chairman Antonio Horta-Osorio resigned after less than nine months for breaching Covid rules. Later the bank was fined for a corruption scandal involving Mozambique's tuna fishing industry. This year the bank was fined over a money-laundering scandal related to a Bulgarian drugs ring, replaced its chief executive, and last month found its shares under pressure from investors concerned about the firm's financial health. Its share price has halved since January.'Question marks'Credit Suisse, Switzerland's second largest bank, said the restructuring would create ""a simpler, more focused and more stable bank"".Ulrich Koerner, who took over as chief executive in July said the bank's performance this year had been affected by ""continued challenging market and macroeconomic conditions"".""This is a historic moment for Credit Suisse. We are radically restructuring the investment bank to help create a new bank that is simpler, more stable and with a more focused business model built around client needs,"" he said.JPMorgan analysts said that ""question marks remain"" over the restructuring, adding that the share sale to raise new money would weigh on the stock price.Andreas Venditti, an analyst at Swiss investment managers Vontobel, said the plan was ""just the first step in a lengthy process to restore credibility and regain the trust"" of stakeholders.""Resolute execution and no further mis-steps will be key and it will take time until results will begin to show,"" he said.Related TopicsCompaniesBankingCredit SuisseMore on this storyCredit Suisse shares hit by financial health fears3 October 2022Credit Suisse guilty over money-laundering charges27 June 2022Greensill lender Credit Suisse axes bosses and pay6 April 2021Credit Suisse boss quits after spying scandal7 February 2020Credit Suisse denies wrongdoing after data leak20 February 2022Top StoriesUK-Israeli mother wounded in West Bank attack diesPublished49 minutes agoLive. Five dead in shooting at Kentucky bankPublished2 hours agoNHS braces for most disruptive walkout yetPublished23 minutes agoFeaturesWhat does the huge leak of Ukraine war documents tell us?We were born on the day the peace deal was signed. VideoWe were born on the day the peace deal was signedMan, 100, learns to walk to attend school assembly. VideoMan, 100, learns to walk to attend school assemblyAngler enjoys rare Channel encounter with whaleTwo years for murder still Good Friday's bitter pillThe EU politician fighting his own extraditionThe refugees making a living after fleeing UkraineWhat lies behind the rise of the contraception app?An asylum seeker's five-nation trek to sanctuaryElsewhere on the BBC'Is this my fault?!'Emily Atack seeks to understand why the blame for unwanted male attention is so often put on the victimAttributioniPlayerFrom party tricks to questionable medicinal claimsExploring the downright bizarre ways that the force of electricity has been harnessed and developedAttributionSoundsCan this determined sleuth solve a mysterious murder case?Anthony Horowitz's mind-bending mystery, starring Lesley ManvilleAttributioniPlayerDo 29,000 coffee pods go to landfill every minute?More or Less explores the environmental consequences of our thirst for coffeeAttributionSoundsMost Read1Rain and 60mph winds to replace Easter sunshine2Dalai Lama regrets asking boy to 'suck my tongue'3UK-Israeli mother wounded in West Bank attack dies4Elf and Barton Fink actor Michael Lerner dies at 815US woman, 78, charged with third bank robbery6Petrol bombs thrown at police at republican parade7Abba in tribute to 'superb' long-serving guitarist8China aircraft carrier 'seals off' Taiwan in drill9Super Mario Movie breaks box office records10Officer among eight injured in Louisville shootingBBC News ServicesOn your mobileOn smart speakersGet news alertsContact BBC NewsBest of the BBCExploring the legacy of the peace dealAttributionBBC iPlayerDo sleepy teas really work?AttributionBBC SoundsWill Grace be able to keep her word?AttributionBBC iPlayerA spinster turned mass poisoner...AttributionBBC SoundsHomeNewsSportWeatheriPlayerSoundsCBBCCBeebiesFoodBitesizeArtsTasterLocalThreeTerms of UseAbout the BBCPrivacy PolicyCookiesAccessibility HelpParental GuidanceContact the BBCMake an editorial complaintGet Personalised NewslettersWhy you can trust the BBC© 2023 BBC. The BBC is not responsible for the content of external sites. Read about our approach to external linking."""
11|2022-10-03T21:25:05.000Z|"""Credit Suisse shares hit by worries over financial health - BBC NewsBBC HomepageSkip to contentAccessibility HelpYour accountNotificationsHomeNewsSportWeatheriPlayerSoundsBitesizeMore menuMore menuSearch BBCHomeNewsSportWeatheriPlayerSoundsBitesizeCBBCCBeebiesFoodClose menuBBC NewsMenuHomeCost of LivingWar in UkraineClimateUKWorldBusinessPoliticsCultureTechMoreScienceHealthFamily & EducationIn PicturesNewsbeatReality CheckDisabilityBusinessYour MoneyMarket DataCompaniesEconomyTechnology of BusinessCEO SecretsGlobal TradeCredit Suisse shares hit by worries over financial healthPublished3 October 2022Shareclose panelShare pageCopy linkAbout sharingImage source, ReutersBy Noor NanjiBusiness reporter, BBC NewsShares in Credit Suisse plunged on Monday as fears mount over the financial health of the Swiss bank.Its shares fell by more than 10%, after the bank's boss failed to reassure investors - but later bounced back.Last week, chief executive Ulrich Koerner insisted in a memo to staff that Credit Suisse's financial position was solid.It comes ahead of a restructuring plan due when the bank reports results at the end of October.Sources close to the bank confirmed a report in the Financial Times that executives at the Swiss bank spent much of the weekend seeking to calm key stakeholders about its financial strength.A Credit Suisse spokesperson refused to comment.Credit Suisse guilty over money-laundering chargesCredit Suisse denies wrongdoing after data leakIn last week's memo, Mr Koerner told staff: ""I trust that you are not confusing our day-to-day stock price performance with the strong capital base and liquidity position of the bank.""He said there were ""many factually inaccurate statements being made"" in the media, but urged staff to stay committed ahead of the transformation plan, which will be unveiled on 27 October.""We are in the process of reshaping Credit Suisse for a long-term, sustainable future - with significant potential for value creation.""I am confident we have what it takes to succeed.""Shares in Credit Suisse have been sliding over the past year amid fear's over the bank's financial position.In July, the bank announced a strategy review and replaced its chief executive, Thomas Gottstein, with Mr Koerner, an asset management expert.Credit Suisse has a major hub in London and employs 5,500 people in the UK.According to Reuters, the Bank of England is monitoring the situation together with the Swiss regulator, FINMA.The Bank of England declined to comment.The chief executive of Credit Suisse insists the bank is as solid and stable as the Matterhorn. The problem is, from the outside it isn't looking that way - and perceptions matter.The bank has been battered by scandal. It lost billions due to the collapse of Archegos Capital Management, suffered further damage from lending to the failed finance company Greensill Capital, and was fined hundreds of millions for its involvement in a loan scandal in Mozambique.Ulrich Koerner was brought earlier this year to implement a major overhaul of the investment banking unit. He's due to unveil his plans later this month.But market moves suggest some investors believe the bank is running out of cash.Mr Koerner claims all is well - and he has written to Credit Suisse staff to reassure them of the fact. The trouble is, that memo itself appears to have triggered further speculation about the health of the business.Related TopicsCompaniesBankingCredit SuisseMore on this storyCredit Suisse guilty over money-laundering charges27 June 2022Credit Suisse denies wrongdoing after data leak20 February 2022Top StoriesUK-Israeli mother wounded in West Bank attack diesPublished49 minutes agoLive. Five dead in shooting at Kentucky bankPublished2 hours agoNHS braces for most disruptive walkout yetPublished23 minutes agoFeaturesWhat does the huge leak of Ukraine war documents tell us?We were born on the day the peace deal was signed. VideoWe were born on the day the peace deal was signedMan, 100, learns to walk to attend school assembly. VideoMan, 100, learns to walk to attend school assemblyAngler enjoys rare Channel encounter with whaleTwo years for murder still Good Friday's bitter pillThe EU politician fighting his own extraditionThe refugees making a living after fleeing UkraineWhat lies behind the rise of the contraception app?An asylum seeker's five-nation trek to sanctuaryElsewhere on the BBC'Is this my fault?!'Emily Atack seeks to understand why the blame for unwanted male attention is so often put on the victimAttributioniPlayerFrom party tricks to questionable medicinal claimsExploring the downright bizarre ways that the force of electricity has been harnessed and developedAttributionSoundsCan this determined sleuth solve a mysterious murder case?Anthony Horowitz's mind-bending mystery, starring Lesley ManvilleAttributioniPlayerDo 29,000 coffee pods go to landfill every minute?More or Less explores the environmental consequences of our thirst for coffeeAttributionSoundsMost Read1Rain and 60mph winds to replace Easter sunshine2Dalai Lama regrets asking boy to 'suck my tongue'3UK-Israeli mother wounded in West Bank attack dies4Elf and Barton Fink actor Michael Lerner dies at 815US woman, 78, charged with third bank robbery6Petrol bombs thrown at police at republican parade7Abba in tribute to 'superb' long-serving guitarist8China aircraft carrier 'seals off' Taiwan in drill9Super Mario Movie breaks box office records10Officer among eight injured in Louisville shootingBBC News ServicesOn your mobileOn smart speakersGet news alertsContact BBC NewsBest of the BBCExploring the legacy of the peace dealAttributionBBC iPlayerDo sleepy teas really work?AttributionBBC SoundsWill Grace be able to keep her word?AttributionBBC iPlayerA spinster turned mass poisoner...AttributionBBC SoundsHomeNewsSportWeatheriPlayerSoundsCBBCCBeebiesFoodBitesizeArtsTasterLocalThreeTerms of UseAbout the BBCPrivacy PolicyCookiesAccessibility HelpParental GuidanceContact the BBCMake an editorial complaintGet Personalised NewslettersWhy you can trust the BBC© 2023 BBC. The BBC is not responsible for the content of external sites. Read about our approach to external linking."""
12|2017-12-08T11:29:33.000Z|"""Learn how the BBC is working to strengthen trust and transparency in online news - BBC NewsBBC HomepageSkip to contentAccessibility HelpYour accountNotificationsHomeNewsSportWeatheriPlayerSoundsBitesizeMore menuMore menuSearch BBCHomeNewsSportWeatheriPlayerSoundsBitesizeCBBCCBeebiesFoodClose menuBBC NewsMenuHomeCost of LivingWar in UkraineClimateUKWorldBusinessPoliticsCultureTechMoreScienceHealthFamily & EducationIn PicturesNewsbeatReality CheckDisabilityLearn how the BBC is working to strengthen trust and transparency in online newsPublished8 December 2017Shareclose panelShare pageCopy linkAbout sharingThe BBC is recognised by audiences in the UK and around the world as a provider of news that you can trust. Our website, like our TV and radio services, strives for journalism that is accurate, impartial, independent and fair.Our editorial values say: ""The trust that our audience has in all our content underpins everything that we do. We are independent, impartial and honest. We are committed to achieving the highest standards of accuracy and impartiality and strive to avoid knowingly or materially misleading our audiences.""Our commitment to impartiality is at the heart of that relationship of trust. In all our output we will treat every subject with an impartiality that reflects the full range of views. We will consider all the relevant facts fairly and with an open mind.""Research shows that, compared to other broadcasters, newspapers and online sites, the BBC is seen as by far the most trusted and impartial news provider in the UK [PDF].Even so, we know that identifying credible journalism on the internet can be a confusing experience. We also know that audiences want to understand more about how BBC journalism is produced.For these reasons, BBC News is making even greater efforts to explain what type of information you are reading or watching on our website, who and where the information is coming from, and how a story was crafted the way it was. By doing so, we can help you judge for yourself why BBC News can be trusted.We are also making these indicators of trustworthy journalism ""machine-readable"", meaning that they can be picked up by search engines and social media platforms, helping them to better identify reliable sources of information too. These indicators comprise the following areas:Newsroom best practiceType of WorkJournalist ExpertiseCitations and ReferencesMethodology

BEST PRACTICEThe BBC has long had its own Editorial Guidelines that apply to all of our content and set out the standards expected of our journalists.  To make it easier to see how BBC guidelines are used in our newsroom, we have listed all the relevant sections on this page.

Mission Statement: The mission of the BBC is to act in the public interest, serving all audiences through the provision of impartial, high-quality and distinctive output and services that inform, educate and entertain. Full details are in the BBC Charter.

Ownership Structure, Funding and Grants: We are independent of outside interests and arrangements that could undermine our editorial integrity.  Our audiences should be confident that our decisions are not influenced by outside interests, political or commercial pressures, or any personal interests. Learn more about how BBC News is funded, in the UK and internationally, in the BBC Charter on the independence of the BBC.Other links:Editorial Guidelines on ImpartialityEditorial Guidelines on Editorial StandardsEditorial Guidelines on Conflicts of InterestBBC Framework Agreement on provision of commercial activitiesGuidelines for BBC Commercial ServicesFounding Date: The BBC was founded on 18 October 1922. Read more about the history of the BBC.Ethics Policy: The BBC's Editorial Guidelines outline the editorial values and practices that all our output is expected to conform to.  Other links:BBC Charter and Framework AgreementBBC World Service Operating Licence

Diversity Policy: Learn about BBC News' commitment to diversity in the BBC Charter.Other links:Editorial Guidelines Section on Impartiality and Diversity of OpinionDiversity and Inclusion pageDiversity Staffing Report: Find out about how BBC News is working to increase diversity in the BBC's Equality Information Report.Corrections: The BBC is committed to achieving due accuracy.  Policies relating to corrections can be found in the following sections of our Editorial Guidelines. Our output must be well sourced, based on sound evidence, thoroughly tested and presented in clear, precise language.  We should be honest and open about what we don't know and avoid unfounded speculation.  Claims, allegations, material facts and other content that cannot be corroborated should normally be attributed.We are open in acknowledging mistakes when they are made and encourage a culture of willingness to learn from them. If an article has been edited since publication to correct a material inaccuracy, a note will be added at the end of the text to signal to the reader there has been an amendment or correction with the date of that change. If there is a small error in a story that does not alter its editorial meaning (eg name misspelling), the correction will be made without an additional note.Unless content is specifically made available only for a limited time period, there is a presumption that material published online will become part of a permanently accessible archive and will not normally be removed. Exceptional circumstances may include legal reasons, personal safety risks, or a serious breach of editorial standards that cannot be rectified except by removal of the material.Other links:Editorial Guidelines on AccountabilityEditorial Guidelines on Removal of Online ContentVerification/Fact-checking Standards: The BBC's accuracy and verification policy is outlined in the Editorial Guidelines on Accuracy.Other links:Ofcom Operating Framework and Licence for the BBCUnnamed Sources:  The BBC's policy and guidance on the use of anonymous sources is detailed in the Editorial Guidelines.Other links:Editorial Guidelines - Mandatory referralsEditorial Guidelines - Gathering materialEditorial Guidelines on user contributions in news outputActionable Feedback: The BBC's complaints procedure is outlined in the BBC Complaints Framework.Other links:Have Your SayContact UsLeadership: Meet the senior executive team that runs the news division: BBC News Board. 

BBC News articles based on original reporting carry bylines (the name of the journalist), as often do those authored by journalists who have a subject specialism.General news stories, which tend to combine information from a variety of sources, including news agencies, BBC Newsgathering and BBC broadcast output, or which may have been produced by several members of staff over the course of the day, do not as a rule carry bylines.Article bylines for many correspondents and editors link to individual blog pages, where biographical information, expertise, and social media details can be found. 

BBC News distinguishes between factual reporting and opinion. We use machine-readable labels in six categories:News - Journalism based on facts, either observed and verified directly by the reporter, or reported and verified from knowledgeable sourcesAnalysis - Output primarily based on the specialist knowledge of an author, whether a BBC journalist or outside expert, to help you understand complex current affairs and trendsAsk the Audience - Content created primarily to elicit direct audience responseExplainer - Content that provides clear factual explanation of the causes or context behind the newsOpinion - BBC News itself is impartial and does not offer opinions but we do sometimes publish expressions of personal views by outside experts, advocating ideas and drawing conclusions based on the author's interpretation of facts and dataReview - Content based on a critical appraisal of an event, a work of art etc, containing first-hand opinion 

Our output, as appropriate to its subject and nature, should be well sourced, based on sound evidence, thoroughly tested and presented in clear, precise language.  We strive to be honest and open about what we don't know and avoid unfounded speculation. Where BBC News relies on a single source for a key aspect of its coverage, we will strive to credit that source, where possible. We usually link to official reports, sets of statistics and other sources of information, to enable you to judge for yourself the underlying information that we are reporting on.Whenever appropriate, we also offer links to relevant third-party websites that provide additional information, source material or informed comment.

For in-depth pieces of work, such as complex investigations or data journalism projects, we will help you understand how we went about our work by showing the underlying data and by disclosing any caveats, assumptions or other methodological frameworks used - for example, the study-design; the sample size; representativeness; margins of error; how the data was collected; geographical relevance and time periods.
BBC News ServicesOn your mobileOn smart speakersGet news alertsContact BBC NewsBest of the BBCExploring the legacy of the peace dealAttributionBBC iPlayerDo sleepy teas really work?AttributionBBC SoundsWill Grace be able to keep her word?AttributionBBC iPlayerA spinster turned mass poisoner...AttributionBBC SoundsHomeNewsSportWeatheriPlayerSoundsCBBCCBeebiesFoodBitesizeArtsTasterLocalThreeTerms of UseAbout the BBCPrivacy PolicyCookiesAccessibility HelpParental GuidanceContact the BBCMake an editorial complaintGet Personalised NewslettersWhy you can trust the BBC© 2023 BBC. The BBC is not responsible for the content of external sites. Read about our approach to external linking."""
