|date|contents
28|2014-02-26T18:07:14.000Z|"""Credit Suisse boss tells Senate that he 'regrets' tax ploy - BBC NewsBBC HomepageSkip to contentAccessibility HelpYour accountNotificationsHomeNewsSportWeatheriPlayerSoundsBitesizeMore menuMore menuSearch BBCHomeNewsSportWeatheriPlayerSoundsBitesizeCBBCCBeebiesFoodClose menuBBC NewsMenuHomeCost of LivingWar in UkraineClimateUKWorldBusinessPoliticsCultureTechMoreScienceHealthFamily & EducationIn PicturesNewsbeatReality CheckDisabilityBusinessYour MoneyMarket DataCompaniesEconomyTechnology of BusinessCEO SecretsGlobal TradeCredit Suisse boss tells Senate that he 'regrets' tax ployPublished26 February 2014Shareclose panelShare pageCopy linkAbout sharingImage source, ReutersImage caption, Brady Dougan, Chief Executive of Credit Suisse is testifying before a US Senate CommitteeThe boss of Swiss bank Credit Suisse has said he ""deeply regrets"" that some of its bankers violated US tax laws.But Chief Executive Brady Dougan said in a statement to a US Senate committee that there was only ""scattered evidence"" of improper conduct.A US Senate report alleged the bank had helped US clients hide billions of dollars from the US taxman.Mr Dougan admitted some private bankers had helped Americans hide income and assets to illegally avoid US tax. Deep regretHe said: ""We deeply regret that - despite the industry-leading compliance measures we have put in place - before 2009, some Credit Suisse private bankers appear to have violated US law.""""The evidence showed that some Swiss-based private bankers went to great lengths to disguise their bad conduct from Credit Suisse executive management.""The report said that in 2006, Credit Suisse held 22,000 accounts from US customers worth 12bn Swiss francs ($13.5bn; £8.1bn).Mr Dougan disputed some of the findings of the report, saying the subcommittee wrongly assumed every US client account held in Switzerland was hidden from the US government.He said the bank was fighting lawsuits in Switzerland from clients trying to prevent it from giving information to the US authorities. ""These are not the actions of an institution flouting US law enforcement or hiding behind Swiss law,"" he said.Stalled effortCurrently, the US Justice Department (DOJ) is investigating 14 Swiss banks over tax evasion - five years after UBS admitted to helping US clients hide money.""It's five years later, and the sad truth is that the era of bank secrecy is not over,"" said Senator Carl Levin, a democrat from Michigan and chairman of the Senate committee that published the report.""We have great concern that the battle to collect those unpaid taxes on hidden offshore assets seems stalled.""During the Senate hearing, US politicians lashed out at Credit Suisse executives both over the bank's behaviour and over the Swiss government's perceived obstructions into helping US authorities identify Americans who are evading tax.""The whole idea that the Swiss government is cooperating with us is a joke,"" said Mr Levin.He also scolded the DOJ for having only identified 238 client names from Credit Suisse out of 20,000 accounts.""To collect those unpaid taxes and hold U.S. tax evaders accountable, the critical first step is to get their names,"" he said.According to the report, after Credit Suisse started phasing out its tax evasion practices, the number of Swiss accounts held by US clients at Credit Suisse fell by 85%.More on this storyCredit Suisse 'aided' US tax evaders26 February 2014Fannie Mae sues over Libor losses1 November 2013Related Internet LinksCredit SuisseThe BBC is not responsible for the content of external sites.Top StoriesUK-Israeli mother wounded in West Bank attack diesPublished50 minutes agoLive. Five dead in shooting at Kentucky bankPublished2 hours agoNHS braces for most disruptive walkout yetPublished23 minutes agoFeaturesWhat does the huge leak of Ukraine war documents tell us?We were born on the day the peace deal was signed. VideoWe were born on the day the peace deal was signedMan, 100, learns to walk to attend school assembly. VideoMan, 100, learns to walk to attend school assemblyAngler enjoys rare Channel encounter with whaleTwo years for murder still Good Friday's bitter pillThe EU politician fighting his own extraditionThe refugees making a living after fleeing UkraineWhat lies behind the rise of the contraception app?An asylum seeker's five-nation trek to sanctuaryElsewhere on the BBC'Is this my fault?!'Emily Atack seeks to understand why the blame for unwanted male attention is so often put on the victimAttributioniPlayerFrom party tricks to questionable medicinal claimsExploring the downright bizarre ways that the force of electricity has been harnessed and developedAttributionSoundsCan this determined sleuth solve a mysterious murder case?Anthony Horowitz's mind-bending mystery, starring Lesley ManvilleAttributioniPlayerDo 29,000 coffee pods go to landfill every minute?More or Less explores the environmental consequences of our thirst for coffeeAttributionSoundsMost Read1Rain and 60mph winds to replace Easter sunshine2Dalai Lama regrets asking boy to 'suck my tongue'3UK-Israeli mother wounded in West Bank attack dies4Elf and Barton Fink actor Michael Lerner dies at 815US woman, 78, charged with third bank robbery6Petrol bombs thrown at police at republican parade7Abba in tribute to 'superb' long-serving guitarist8China aircraft carrier 'seals off' Taiwan in drill9Super Mario Movie breaks box office records10Officer among eight injured in Louisville shootingBBC News ServicesOn your mobileOn smart speakersGet news alertsContact BBC NewsBest of the BBCExploring the legacy of the peace dealAttributionBBC iPlayerDo sleepy teas really work?AttributionBBC SoundsWill Grace be able to keep her word?AttributionBBC iPlayerA spinster turned mass poisoner...AttributionBBC SoundsHomeNewsSportWeatheriPlayerSoundsCBBCCBeebiesFoodBitesizeArtsTasterLocalThreeTerms of UseAbout the BBCPrivacy PolicyCookiesAccessibility HelpParental GuidanceContact the BBCMake an editorial complaintGet Personalised NewslettersWhy you can trust the BBC© 2023 BBC. The BBC is not responsible for the content of external sites. Read about our approach to external linking."""
29|2011-07-15T07:04:28.000Z|"""Credit Suisse target of US probe into tax dodgers - BBC NewsBBC HomepageSkip to contentAccessibility HelpYour accountNotificationsHomeNewsSportWeatheriPlayerSoundsBitesizeMore menuMore menuSearch BBCHomeNewsSportWeatheriPlayerSoundsBitesizeCBBCCBeebiesFoodClose menuBBC NewsMenuHomeCost of LivingWar in UkraineClimateUKWorldBusinessPoliticsCultureTechMoreScienceHealthFamily & EducationIn PicturesNewsbeatReality CheckDisabilityBusinessYour MoneyMarket DataCompaniesEconomyTechnology of BusinessCEO SecretsGlobal TradeCredit Suisse target of US probe into tax dodgersPublished15 July 2011Shareclose panelShare pageCopy linkAbout sharingImage caption, Credit Suisse is the second Swiss bank investigated for helping US citizens avoid taxUS authorities are investigating whether banking giant Credit Suisse helped US citizens evade paying taxes.The Swiss bank said said it had been notified that it was a ""target"" for investigation, but argued that this was part of a ""broader industry inquiry"".Credit Suisse said it would cooperate with the investigation ""subject to Swiss legal obligations"".In February the US indicted four Credit Suisse bankers for helping taxpayers hide money in secret bank accounts.At the time, Credit Suisse had said that it was not part of the investigation.Tax crackdownIn recent years US authorities have pressured several global banks to help them fight tax evasion.The US Department of Justice's primary target was another Swiss bank, UBS.It threatened the Swiss bank with legal action if it failed to hand over the details of 4,450 US customers suspected of tax dodging.Following years of intense pressure from the United States, in June last year the Swiss parliament passed legislation permitting the country's banks to share customer details with US tax authorities. UBS ended up paying a $780m fine, but more importantly the new legislation put an end to Switzerland's famed banking secrecy.Earlier this year, US authorities said they were investigating the role of UK bank HSBC in helping Indian citizens living in the United States to evade taxes.More on this storyHSBC comes under US tax scrutiny8 April 2011UBS up as rich clients flock back26 April 2011Swiss banker tried over secrecy19 January 2011Swiss MPs back tax evasion deal15 June 2010Swiss set to share UBS tax data25 November 2009Related Internet LinksCredit SuisseUS Department of JusticeThe BBC is not responsible for the content of external sites.Top StoriesUK-Israeli mother wounded in West Bank attack diesPublished50 minutes agoLive. Five dead in shooting at Kentucky bankPublished2 hours agoNHS braces for most disruptive walkout yetPublished23 minutes agoFeaturesWhat does the huge leak of Ukraine war documents tell us?We were born on the day the peace deal was signed. VideoWe were born on the day the peace deal was signedMan, 100, learns to walk to attend school assembly. VideoMan, 100, learns to walk to attend school assemblyAngler enjoys rare Channel encounter with whaleTwo years for murder still Good Friday's bitter pillThe EU politician fighting his own extraditionThe refugees making a living after fleeing UkraineWhat lies behind the rise of the contraception app?An asylum seeker's five-nation trek to sanctuaryElsewhere on the BBC'Is this my fault?!'Emily Atack seeks to understand why the blame for unwanted male attention is so often put on the victimAttributioniPlayerFrom party tricks to questionable medicinal claimsExploring the downright bizarre ways that the force of electricity has been harnessed and developedAttributionSoundsCan this determined sleuth solve a mysterious murder case?Anthony Horowitz's mind-bending mystery, starring Lesley ManvilleAttributioniPlayerDo 29,000 coffee pods go to landfill every minute?More or Less explores the environmental consequences of our thirst for coffeeAttributionSoundsMost Read1Rain and 60mph winds to replace Easter sunshine2Dalai Lama regrets asking boy to 'suck my tongue'3UK-Israeli mother wounded in West Bank attack dies4Elf and Barton Fink actor Michael Lerner dies at 815US woman, 78, charged with third bank robbery6Petrol bombs thrown at police at republican parade7Abba in tribute to 'superb' long-serving guitarist8China aircraft carrier 'seals off' Taiwan in drill9Super Mario Movie breaks box office records10Officer among eight injured in Louisville shootingBBC News ServicesOn your mobileOn smart speakersGet news alertsContact BBC NewsBest of the BBCExploring the legacy of the peace dealAttributionBBC iPlayerDo sleepy teas really work?AttributionBBC SoundsWill Grace be able to keep her word?AttributionBBC iPlayerA spinster turned mass poisoner...AttributionBBC SoundsHomeNewsSportWeatheriPlayerSoundsCBBCCBeebiesFoodBitesizeArtsTasterLocalThreeTerms of UseAbout the BBCPrivacy PolicyCookiesAccessibility HelpParental GuidanceContact the BBCMake an editorial complaintGet Personalised NewslettersWhy you can trust the BBC© 2023 BBC. The BBC is not responsible for the content of external sites. Read about our approach to external linking."""
30|2012-02-09T07:52:20.000Z|"""Credit Suisse bank falls into loss - BBC NewsBBC HomepageSkip to contentAccessibility HelpYour accountNotificationsHomeNewsSportWeatheriPlayerSoundsBitesizeMore menuMore menuSearch BBCHomeNewsSportWeatheriPlayerSoundsBitesizeCBBCCBeebiesFoodClose menuBBC NewsMenuHomeCost of LivingWar in UkraineClimateUKWorldBusinessPoliticsCultureTechMoreScienceHealthFamily & EducationIn PicturesNewsbeatReality CheckDisabilityBusinessYour MoneyMarket DataCompaniesEconomyTechnology of BusinessCEO SecretsGlobal TradeCredit Suisse bank falls into lossPublished9 February 2012Shareclose panelShare pageCopy linkAbout sharingImage caption, Credit Suisse employs about 50,000 people worldwideCredit Suisse has reported a loss of 637m Swiss francs ($698m; £440m) for the last three months of 2011.Brady Dougan, chief executive of Switzerland's second-largest bank, described the loss as ""disappointing"".Credit Suisse has been cutting costs aggressively in order to meet new rules on the amount of capital banks must hold in reserve.The loss compares with a 683m-franc profit that the bank reported in the fourth quarter a year ago.In a statement, Mr Dougan said: ""Our performance for the fourth quarter 2011 was disappointing.""It reflects both the adverse market conditions during the period and the impact of the measures we have taken to swiftly adapt our business to the evolving market and regulatory requirements.''Credit Suisse employs about 50,000 staff worldwide and manages more than $1 trillion in assets.Related Internet LinksCredit SuisseThe BBC is not responsible for the content of external sites.Top StoriesUK-Israeli mother wounded in West Bank attack diesPublished50 minutes agoLive. Five dead in shooting at Kentucky bankPublished2 hours agoNHS braces for most disruptive walkout yetPublished23 minutes agoFeaturesWhat does the huge leak of Ukraine war documents tell us?We were born on the day the peace deal was signed. VideoWe were born on the day the peace deal was signedMan, 100, learns to walk to attend school assembly. VideoMan, 100, learns to walk to attend school assemblyAngler enjoys rare Channel encounter with whaleTwo years for murder still Good Friday's bitter pillThe EU politician fighting his own extraditionThe refugees making a living after fleeing UkraineWhat lies behind the rise of the contraception app?An asylum seeker's five-nation trek to sanctuaryElsewhere on the BBC'Is this my fault?!'Emily Atack seeks to understand why the blame for unwanted male attention is so often put on the victimAttributioniPlayerFrom party tricks to questionable medicinal claimsExploring the downright bizarre ways that the force of electricity has been harnessed and developedAttributionSoundsCan this determined sleuth solve a mysterious murder case?Anthony Horowitz's mind-bending mystery, starring Lesley ManvilleAttributioniPlayerDo 29,000 coffee pods go to landfill every minute?More or Less explores the environmental consequences of our thirst for coffeeAttributionSoundsMost Read1Rain and 60mph winds to replace Easter sunshine2Dalai Lama regrets asking boy to 'suck my tongue'3UK-Israeli mother wounded in West Bank attack dies4Elf and Barton Fink actor Michael Lerner dies at 815US woman, 78, charged with third bank robbery6Petrol bombs thrown at police at republican parade7Abba in tribute to 'superb' long-serving guitarist8China aircraft carrier 'seals off' Taiwan in drill9Super Mario Movie breaks box office records10Officer among eight injured in Louisville shootingBBC News ServicesOn your mobileOn smart speakersGet news alertsContact BBC NewsBest of the BBCExploring the legacy of the peace dealAttributionBBC iPlayerDo sleepy teas really work?AttributionBBC SoundsWill Grace be able to keep her word?AttributionBBC iPlayerA spinster turned mass poisoner...AttributionBBC SoundsHomeNewsSportWeatheriPlayerSoundsCBBCCBeebiesFoodBitesizeArtsTasterLocalThreeTerms of UseAbout the BBCPrivacy PolicyCookiesAccessibility HelpParental GuidanceContact the BBCMake an editorial complaintGet Personalised NewslettersWhy you can trust the BBC© 2023 BBC. The BBC is not responsible for the content of external sites. Read about our approach to external linking."""
31|2014-05-20T10:49:38.000Z|"""Credit Suisse pleads guilty to helping 'tax cheats' - BBC NewsBBC HomepageSkip to contentAccessibility HelpYour accountNotificationsHomeNewsSportWeatheriPlayerSoundsBitesizeMore menuMore menuSearch BBCHomeNewsSportWeatheriPlayerSoundsBitesizeCBBCCBeebiesFoodClose menuBBC NewsMenuHomeCost of LivingWar in UkraineClimateUKWorldBusinessPoliticsCultureTechMoreScienceHealthFamily & EducationIn PicturesNewsbeatReality CheckDisabilityBusinessYour MoneyMarket DataCompaniesEconomyTechnology of BusinessCEO SecretsGlobal TradeCredit Suisse pleads guilty to helping 'tax cheats'Published20 May 2014Shareclose panelShare pageCopy linkAbout sharingThis video can not be playedTo play this video you need to enable JavaScript in your browser.Media caption, Eric Holder: ""Credit Suisse engaged in a wide ranging conspiracy""Swiss banking giant Credit Suisse has pleaded guilty to helping thousands of US clients evade paying taxes to the US government and agreed to pay a $2.6bn (£1.5bn) fine.It is the biggest bank to plead guilty to criminal charges in the US in more than 20 years.US attorney general Eric Holder said the bank helped US ""tax cheats dodge US taxes"".Credit Suisse said in a statement it deeply regretted the past misconduct.The bank said the settlement would reduce its second-quarter net profit by 1.6bn Swiss Francs ($1.8bn; £1bn).The $2.6bn payment is the highest in a US criminal tax investigation to date, according to US authorities.However, as part of the agreement with US regulators, the bank will not lose its banking licence in the US.The bank does not expect its UK and Swiss banking licences to be affected.Credit Suisse chief executive Brady Dougan said: ""Having this matter fully resolved is an important step forward for us.""We have seen no material impact on our business resulting from the heightened public attention on this issue in the past several weeks.""'Elaborate lengths'Mr Holder told a press conference: ""The bank went to elaborate lengths to shield itself, its employees, and the tax cheats it served, from accountability for their criminal actions."" ""They subverted disclosure requirements, destroyed bank records, and concealed transactions involving undeclared accounts by limiting withdrawal amounts and using offshore credit and debit cards to repatriate funds.""He added that the tax evasion schemes went back decades, saying that in one case, the practice of using sham entities began more than 100 years ago.The US Department of Justice said Credit Suisse ""operated an illegal cross-border banking business"" that helped thousands of US customers conceal offshore assets and income from US tax authorities.However, according to US media reports, neither Credit Suisse chairman Urs Rohner nor chief executive Brady Dougan are expected to lose their jobs as a result of the agreement.Mr Dougan told investors on Tuesday he had not encountered pressure to step down.""My focus has been on resolving the issue and taking the business forward, so no, that's never been a consideration,"" he said. ""We're working very very hard to fix this business.""Credit Suisse will meet most of the cost of the fine by selling some of its risky assets, the bank's chief financial officer David Mathers said.Since 2011 US authorities have indicted eight Credit Suisse employees who helped clients evade taxes.Credit Suisse is not alone. US prosecutors are chasing more than a dozen other Swiss banks for allegedly helping wealthy Americans dodge US taxes, and at the press conference, they hinted that there would be more settlements to come.In 2009, another Swiss bank, UBS, settled similar charges with US regulators for $780m as well as an agreement in which the bank would give US authorities the names of its so-called ""secret"" account holders.Top StoriesUK-Israeli mother wounded in West Bank attack diesPublished50 minutes agoLive. Five dead in shooting at Kentucky bankPublished2 hours agoNHS braces for most disruptive walkout yetPublished23 minutes agoFeaturesWhat does the huge leak of Ukraine war documents tell us?We were born on the day the peace deal was signed. VideoWe were born on the day the peace deal was signedMan, 100, learns to walk to attend school assembly. VideoMan, 100, learns to walk to attend school assemblyAngler enjoys rare Channel encounter with whaleTwo years for murder still Good Friday's bitter pillThe EU politician fighting his own extraditionThe refugees making a living after fleeing UkraineWhat lies behind the rise of the contraception app?An asylum seeker's five-nation trek to sanctuaryElsewhere on the BBC'Is this my fault?!'Emily Atack seeks to understand why the blame for unwanted male attention is so often put on the victimAttributioniPlayerFrom party tricks to questionable medicinal claimsExploring the downright bizarre ways that the force of electricity has been harnessed and developedAttributionSoundsCan this determined sleuth solve a mysterious murder case?Anthony Horowitz's mind-bending mystery, starring Lesley ManvilleAttributioniPlayerDo 29,000 coffee pods go to landfill every minute?More or Less explores the environmental consequences of our thirst for coffeeAttributionSoundsMost Read1Rain and 60mph winds to replace Easter sunshine2Dalai Lama regrets asking boy to 'suck my tongue'3UK-Israeli mother wounded in West Bank attack dies4Elf and Barton Fink actor Michael Lerner dies at 815US woman, 78, charged with third bank robbery6Petrol bombs thrown at police at republican parade7Abba in tribute to 'superb' long-serving guitarist8China aircraft carrier 'seals off' Taiwan in drill9Super Mario Movie breaks box office records10Officer among eight injured in Louisville shootingBBC News ServicesOn your mobileOn smart speakersGet news alertsContact BBC NewsBest of the BBCExploring the legacy of the peace dealAttributionBBC iPlayerDo sleepy teas really work?AttributionBBC SoundsWill Grace be able to keep her word?AttributionBBC iPlayerA spinster turned mass poisoner...AttributionBBC SoundsHomeNewsSportWeatheriPlayerSoundsCBBCCBeebiesFoodBitesizeArtsTasterLocalThreeTerms of UseAbout the BBCPrivacy PolicyCookiesAccessibility HelpParental GuidanceContact the BBCMake an editorial complaintGet Personalised NewslettersWhy you can trust the BBC© 2023 BBC. The BBC is not responsible for the content of external sites. Read about our approach to external linking."""
