|date|contents
0|2023-04-04T16:26:35.000Z|"""Credit Suisse investors angrily confront bank as chairman says sorry - BBC NewsBBC HomepageSkip to contentAccessibility HelpYour accountNotificationsHomeNewsSportWeatheriPlayerSoundsBitesizeMore menuMore menuSearch BBCHomeNewsSportWeatheriPlayerSoundsBitesizeCBBCCBeebiesFoodClose menuBBC NewsMenuHomeCost of LivingWar in UkraineClimateUKWorldBusinessPoliticsCultureTechMoreScienceHealthFamily & EducationIn PicturesNewsbeatReality CheckDisabilityBusinessYour MoneyMarket DataCompaniesEconomyTechnology of BusinessCEO SecretsGlobal TradeCredit Suisse investors angrily confront bank as chairman says sorryPublished6 days agoShareclose panelShare pageCopy linkAbout sharingImage source, EPAImage caption, Credit Suisse's chief executive Ulrich Korner faced investors on TuesdayBy Vishala Sri-PathmaBBC NewsShareholders in Credit Suisse have told the firm they feel ""failed"" and ""cheated"" after the collapsed bank was rescued by its long-time rival UBS.  On Tuesday, the 167-year old Swiss bank faced investors for the first time since the deal was struck and for the last time as an independent firm. Credit Suisse chairman Axel Lehmann said he was ""truly sorry"". But one investor told the bank that shareholders had ""everything stolen from them"". Credit Suisse was rescued by UBS last month in a deal brokered by authorities after turmoil in the US banking sector sent the Swiss lender's shares tumbling.The loss-making bank had already been struggling for a number of years after a series of scandals, compliance problems and bad financial bets.Mr Lehmann told investors at the Annual General Meeting that management had a plan to turn things around but had been ""thwarted"" by fears prompted by the collapse of Silicon Valley Bank in the US. But one shareholder suggested the board would have been crucified in medieval times.Another held up a sack of empty walnut shells, saying they cost the same as a single Credit Suisse share.Credit Suisse's chief executive Ulrich Korner said: ""I understand that you feel disappointed, shocked, or angry.""I share the disappointment of you, our shareholders, but I also share the disappointment of all of our employees, our clients and, ultimately, the general public.""Swiss probe into UBS takeover of Credit SuisseCredit Suisse crisis is a blow to Swiss stabilityShareholders in both Credit Suisse and UBS - which will hold an investor meeting on Wednesday - have been denied a vote on the takeover because of the emergency measures taken by the Swiss government to rush the deal through.Mr Lehmann said the only other option would have been bankruptcy.""This would have led to the worst scenario, namely a total loss for shareholders, unpredictable risks for clients, severe consequences for the economy and the global financial markets,"" he said. ""It was our duty to protect the interests of our shareholders as best we could to provide security to our clients. We did everything we could within what was possible.""Analysis by Imogen Foulkes, BBC Geneva correspondentCredit Suisse bosses knew they would have to eat humble pie at this meeting, but despite numerous apologies the shareholders remain angry. It's common for middle-class Swiss people, especially the elderly, to invest money in a few shares as a back-up to their pensions. What have they traditionally considered safe? Switzerland's two biggest banks. But now Credit Suisse shares are worth less than 10% of what they were two years ago. One man representing a group of shareholders accused Credit Suisse management of ""greed and incompetence"", another pointed to his red tie, saying he was wearing it to represent the ""red card"" Credit Suisse deserved. Others turned their anger on the Swiss government, which forced through the takeover by UBS over just one weekend while the markets were closed. Some of us, said one shareholder, spend more time choosing our smartphones. Venting their anger is just about the only action the shareholders can take; the deal with UBS is done. Apologising again, CEO Ulrich Korner said there had been little choice, it was either take the deal with UBS or bankruptcy, which he said would have been catastrophic not just for Switzerland, but for the entire global economy.Related TopicsUBSBankingCredit SuisseMore on this storySwiss probe into UBS takeover of Credit Suisse2 AprilCredit Suisse crisis is a blow to Swiss stability19 MarchTop StoriesUK-Israeli mother wounded in West Bank attack diesPublished49 minutes agoLive. Five dead in shooting at Kentucky bankPublished2 hours agoNHS braces for most disruptive walkout yetPublished23 minutes agoFeaturesWhat does the huge leak of Ukraine war documents tell us?We were born on the day the peace deal was signed. VideoWe were born on the day the peace deal was signedMan, 100, learns to walk to attend school assembly. VideoMan, 100, learns to walk to attend school assemblyAngler enjoys rare Channel encounter with whaleTwo years for murder still Good Friday's bitter pillThe EU politician fighting his own extraditionThe refugees making a living after fleeing UkraineWhat lies behind the rise of the contraception app?An asylum seeker's five-nation trek to sanctuaryElsewhere on the BBC'Is this my fault?!'Emily Atack seeks to understand why the blame for unwanted male attention is so often put on the victimAttributioniPlayerFrom party tricks to questionable medicinal claimsExploring the downright bizarre ways that the force of electricity has been harnessed and developedAttributionSoundsCan this determined sleuth solve a mysterious murder case?Anthony Horowitz's mind-bending mystery, starring Lesley ManvilleAttributioniPlayerDo 29,000 coffee pods go to landfill every minute?More or Less explores the environmental consequences of our thirst for coffeeAttributionSoundsMost Read1Rain and 60mph winds to replace Easter sunshine2Dalai Lama regrets asking boy to 'suck my tongue'3UK-Israeli mother wounded in West Bank attack dies4Elf and Barton Fink actor Michael Lerner dies at 815US woman, 78, charged with third bank robbery6Petrol bombs thrown at police at republican parade7Abba in tribute to 'superb' long-serving guitarist8China aircraft carrier 'seals off' Taiwan in drill9Super Mario Movie breaks box office records10Officer among eight injured in Louisville shootingBBC News ServicesOn your mobileOn smart speakersGet news alertsContact BBC NewsBest of the BBCExploring the legacy of the peace dealAttributionBBC iPlayerDo sleepy teas really work?AttributionBBC SoundsWill Grace be able to keep her word?AttributionBBC iPlayerA spinster turned mass poisoner...AttributionBBC SoundsHomeNewsSportWeatheriPlayerSoundsCBBCCBeebiesFoodBitesizeArtsTasterLocalThreeTerms of UseAbout the BBCPrivacy PolicyCookiesAccessibility HelpParental GuidanceContact the BBCMake an editorial complaintGet Personalised NewslettersWhy you can trust the BBC© 2023 BBC. The BBC is not responsible for the content of external sites. Read about our approach to external linking."""
1|2023-04-02T16:20:50.000Z|"""Swiss probe into UBS takeover of Credit Suisse - BBC NewsBBC HomepageSkip to contentAccessibility HelpYour accountNotificationsHomeNewsSportWeatheriPlayerSoundsBitesizeMore menuMore menuSearch BBCHomeNewsSportWeatheriPlayerSoundsBitesizeCBBCCBeebiesFoodClose menuBBC NewsMenuHomeCost of LivingWar in UkraineClimateUKWorldBusinessPoliticsCultureTechMoreScienceHealthFamily & EducationIn PicturesNewsbeatReality CheckDisabilityBusinessYour MoneyMarket DataCompaniesEconomyTechnology of BusinessCEO SecretsGlobal TradeSwiss probe into UBS takeover of Credit SuissePublished2 AprilShareclose panelShare pageCopy linkAbout sharingImage source, ReutersBy Faarea MasudBusiness reporterSwiss prosecutors have opened an investigation into the sudden takeover of the country's second-largest bank, Credit Suisse, by its rival, UBS.The deal was rushed through last month, when fears rose about Credit Suisse's financial position.Switzerland's Federal Prosecutor said on Sunday that it would investigate if any possible ""criminal offences"" had been committed.Both Credit Suisse and UBS declined to comment.The deal for UBS to buy Credit Suisse was backed by the Swiss government, and was put together rapidly after a weekend of emergency talks between the two banks and the country's financial regulators. At the time, the Swiss National Bank said the deal was the best way to restore the confidence of financial markets and to manage risks to the economy. The takeover came as markets were being rattled by fears over the health of the global financial system following the failures of two smaller US banks.The deal, when it was announced, valued Credit Suisse at $3.15bn (£2.6bn), whereas on the Friday before the settlement was reached it had been valued at about $8bn.However, the deal has angered taxpayers and shareholders of both banks, who were deprived of a vote on the takeover. Some have also argued it has damaged Switzerland's global reputation as a financial centre.In statement issued on Sunday, Switzerland's Federal Prosecutor said there were ""numerous aspects of events around Credit Suisse"" that need to be investigated to identify any possible ""criminal offences"".""The Office of the Attorney General wants to proactively fulfil its mandate and responsibility to contribute to a clean Swiss financial centre and has set up a monitoring system so that it can take action immediately on any issues that fall within its area of responsibility,"" it added.It added it had made contact with ""national and cantonal authorities"", and that ""investigative orders were also issued"".Separately, Swiss newspaper Tages-Anzeiger reported on Sunday that the newly combined UBS-Credit Suisse bank was set to cut its workforce by 20-30%.The combined bank will have more than 120,000 staff worldwide. The report said about 11,000 jobs could be cut in Switzerland.Related TopicsCompaniesUBSBankingCredit SuisseMore on this storyUK banking system 'safe' after Credit Suisse rescue20 MarchTop StoriesUK-Israeli mother wounded in West Bank attack diesPublished49 minutes agoLive. Five dead in shooting at Kentucky bankPublished2 hours agoNHS braces for most disruptive walkout yetPublished23 minutes agoFeaturesWhat does the huge leak of Ukraine war documents tell us?We were born on the day the peace deal was signed. VideoWe were born on the day the peace deal was signedMan, 100, learns to walk to attend school assembly. VideoMan, 100, learns to walk to attend school assemblyAngler enjoys rare Channel encounter with whaleTwo years for murder still Good Friday's bitter pillThe EU politician fighting his own extraditionThe refugees making a living after fleeing UkraineWhat lies behind the rise of the contraception app?An asylum seeker's five-nation trek to sanctuaryElsewhere on the BBC'Is this my fault?!'Emily Atack seeks to understand why the blame for unwanted male attention is so often put on the victimAttributioniPlayerFrom party tricks to questionable medicinal claimsExploring the downright bizarre ways that the force of electricity has been harnessed and developedAttributionSoundsCan this determined sleuth solve a mysterious murder case?Anthony Horowitz's mind-bending mystery, starring Lesley ManvilleAttributioniPlayerDo 29,000 coffee pods go to landfill every minute?More or Less explores the environmental consequences of our thirst for coffeeAttributionSoundsMost Read1Rain and 60mph winds to replace Easter sunshine2Dalai Lama regrets asking boy to 'suck my tongue'3UK-Israeli mother wounded in West Bank attack dies4Elf and Barton Fink actor Michael Lerner dies at 815US woman, 78, charged with third bank robbery6Petrol bombs thrown at police at republican parade7Abba in tribute to 'superb' long-serving guitarist8China aircraft carrier 'seals off' Taiwan in drill9Super Mario Movie breaks box office records10Officer among eight injured in Louisville shootingBBC News ServicesOn your mobileOn smart speakersGet news alertsContact BBC NewsBest of the BBCExploring the legacy of the peace dealAttributionBBC iPlayerDo sleepy teas really work?AttributionBBC SoundsWill Grace be able to keep her word?AttributionBBC iPlayerA spinster turned mass poisoner...AttributionBBC SoundsHomeNewsSportWeatheriPlayerSoundsCBBCCBeebiesFoodBitesizeArtsTasterLocalThreeTerms of UseAbout the BBCPrivacy PolicyCookiesAccessibility HelpParental GuidanceContact the BBCMake an editorial complaintGet Personalised NewslettersWhy you can trust the BBC© 2023 BBC. The BBC is not responsible for the content of external sites. Read about our approach to external linking."""
2|2023-03-19T12:54:46.000Z|"""Credit Suisse bank: UBS is in talks to take over its troubled rival - BBC NewsBBC HomepageSkip to contentAccessibility HelpYour accountNotificationsHomeNewsSportWeatheriPlayerSoundsBitesizeMore menuMore menuSearch BBCHomeNewsSportWeatheriPlayerSoundsBitesizeCBBCCBeebiesFoodClose menuBBC NewsMenuHomeCost of LivingWar in UkraineClimateUKWorldBusinessPoliticsCultureTechMoreScienceHealthFamily & EducationIn PicturesNewsbeatReality CheckDisabilityBusinessYour MoneyMarket DataCompaniesEconomyTechnology of BusinessCEO SecretsGlobal TradeCredit Suisse bank: UBS is in talks to take over its troubled rivalPublished19 MarchShareclose panelShare pageCopy linkAbout sharingImage source, Getty ImagesImage caption, Credit Suisse has faced a string of scandals in recent years, including money laundering chargesBy Kathryn Armstrong & Lucy HookerBBC NewsSwitzerland's biggest bank, UBS, is in advanced talks to buy all or part of its troubled rival Credit Suisse.Credit Suisse, the second largest Swiss bank, is facing a crisis of confidence and its shares have fallen sharply in recent days, sending ripples of concern through the markets.According to the Financial Times UBS is offering to pay up to $1bn (£820m) for Credit Suisse.Regulators are trying to facilitate a deal before markets reopen on Monday.The trouble at Credit Suisse, combined with the failure of two smaller US banks during the last two weeks, have thrown the health of the global financial system into doubt.Credit Suisse is one of around 30 banks worldwide deemed too big to fail because they are of such importance to the banking system.But the 167-year-old institution is loss-making and has faced a string of problems in recent years, including money laundering charges.An emergency $54bn (£44.5bn) lifeline from the Swiss National Bank on Wednesday failed to reassure markets and Credit Suisse shares tumbled 24%, prompting a wider sell-off on European markets.A deal could be signed as soon as Sunday evening, according to the FT, which first reported that regulators and the Swiss National Bank were facilitating talks between the two Swiss banking giants.The deal currently believed to be on the table would value Credit Suisse shares at less than a seventh of the price they were on Friday. However the FT said terms could change and a deal had not yet been reached.Image source, EPAImage caption, Senior figures from UBS were seen heading to the Swiss government's finance department on SundayUBS shareholders would normally have six weeks to consider a deal on this scale, but the FT says the Swiss authorities are planning to change the country's laws to bypass a shareholder vote on the transaction.Bank of England officials have confirmed they are in close contact with their counterparts at the Swiss National Bank while regulators and management discuss Credit Suisse's future. The UK Treasury is also monitoring the situation.Is this a banking crisis - how worried should I be?The deal would amount to a significant intervention from the Swiss authorities, said Mohamed El-Erian, chief economic advisor to German financial services firm Allianz.""This is not a voluntary action, this is a shotgun wedding and it's being done in order to restore financial stability,"" Mr El-Erian told the BBC. ""Without it Credit Suisse may end up in a death spiral, in which it finds it much harder to undertake its banking activities.""That could raise questions about other banks at a time when there are also banking concerns in the United States.""Mr El-Erian said the current turmoil could lead to banks becoming more ""risk averse"", leading to a fall in credit availability. But that amounted to a ""headwind"" for the global economy, rather than something like the sudden stop experienced during the 2008 financial crisis, which was ""in a completely different league"" to today's problems, he said.UBS is said to have asked the Swiss government to cover about $6bn (£4.9bn) in costs if it were to buy Credit Suisse, according to sources quoted by Reuters.  Credit Suisse reported a loss of 7.3bn Swiss francs ($7.9bn; £6.5bn) in 2022 - its worst year since the financial crisis of 2008 - and has warned it does not expect to be profitable until 2024.UBS, however, made a profit of $7.6bn in 2022.Any deal may also result in significant job losses. As well as being a domestic bank with 95 branches, Credit Suisse has a global investment banking operation and manages the assets of rich clients. At the end of last year Credit Suisse had a global staff of 50,480, including 16,700 in Switzerland, though 9,000 jobs were to be axed, the Swiss broadcaster SRF reports.Related TopicsBankingCredit SuisseSwitzerlandMore on this storyCredit Suisse to borrow $54bn to shore up finances16 MarchMulti-billion dollar rescue deal for US bank16 MarchIs this a banking crisis - how worried should I be?21 MarchCredit Suisse cuts 9,000 jobs to stem losses27 October 2022Top StoriesUK-Israeli mother wounded in West Bank attack diesPublished49 minutes agoLive. Five dead in shooting at Kentucky bankPublished2 hours agoNHS braces for most disruptive walkout yetPublished23 minutes agoFeaturesWhat does the huge leak of Ukraine war documents tell us?We were born on the day the peace deal was signed. VideoWe were born on the day the peace deal was signedMan, 100, learns to walk to attend school assembly. VideoMan, 100, learns to walk to attend school assemblyAngler enjoys rare Channel encounter with whaleTwo years for murder still Good Friday's bitter pillThe EU politician fighting his own extraditionThe refugees making a living after fleeing UkraineWhat lies behind the rise of the contraception app?An asylum seeker's five-nation trek to sanctuaryElsewhere on the BBC'Is this my fault?!'Emily Atack seeks to understand why the blame for unwanted male attention is so often put on the victimAttributioniPlayerFrom party tricks to questionable medicinal claimsExploring the downright bizarre ways that the force of electricity has been harnessed and developedAttributionSoundsCan this determined sleuth solve a mysterious murder case?Anthony Horowitz's mind-bending mystery, starring Lesley ManvilleAttributioniPlayerDo 29,000 coffee pods go to landfill every minute?More or Less explores the environmental consequences of our thirst for coffeeAttributionSoundsMost Read1Rain and 60mph winds to replace Easter sunshine2Dalai Lama regrets asking boy to 'suck my tongue'3UK-Israeli mother wounded in West Bank attack dies4Elf and Barton Fink actor Michael Lerner dies at 815US woman, 78, charged with third bank robbery6Petrol bombs thrown at police at republican parade7Abba in tribute to 'superb' long-serving guitarist8China aircraft carrier 'seals off' Taiwan in drill9Super Mario Movie breaks box office records10Officer among eight injured in Louisville shootingBBC News ServicesOn your mobileOn smart speakersGet news alertsContact BBC NewsBest of the BBCExploring the legacy of the peace dealAttributionBBC iPlayerDo sleepy teas really work?AttributionBBC SoundsWill Grace be able to keep her word?AttributionBBC iPlayerA spinster turned mass poisoner...AttributionBBC SoundsHomeNewsSportWeatheriPlayerSoundsCBBCCBeebiesFoodBitesizeArtsTasterLocalThreeTerms of UseAbout the BBCPrivacy PolicyCookiesAccessibility HelpParental GuidanceContact the BBCMake an editorial complaintGet Personalised NewslettersWhy you can trust the BBC© 2023 BBC. The BBC is not responsible for the content of external sites. Read about our approach to external linking."""
